{
  "$schema": "./settings.schema.json",
  "theme": "dark",
  "ai_recommendation_interval_seconds": 300,
  "chrome_tab_recommendation_interval_seconds": 300,
  "ai_auto_optimize_cooldown_seconds": 300,
  "auto_clean_interval_seconds": 900,
  "ram_purge_interval_seconds": 300,
  "ai_target_available_ram_mb": 3072,
  "dashboard_status_interval_seconds": 10,
  "dashboard_process_interval_seconds": 15,
  "dashboard_alert_interval_seconds": 10,
  "dashboard_history_interval_seconds": 60,
  "show_ai_recommendations": true,
  "show_chrome_tab_optimizer": true,
  "show_garbage_breakdown": true,
  "show_ram_breakdown": true,
  "show_rule_recommendations": true,
  "show_cleanup_history": true
}
